{
  "version": 1,
  "initial_total": 230,
  "scope": "出航時230人の復元名簿。王族本人・マフィア・下層兵力を含む船全体の総数ではない。",
  "members": [
    {
      "slot_id": "INIT-P01-PRIVATE-01",
      "character_id": "P01-P03",
      "initial": true,
      "prince_ranks": [
        1
      ],
      "queen_rank": null,
      "queen_pool": [],
      "identity_pool": null,
      "group": "private",
      "basis": "reconstructed",
      "notes": "派遣先のcamp・IDのP07/P11を所属元に読み替えず、第1王子の出身枠で一度だけ数える。チヤマシ等の出航時の在室は別途確認。",
      "history": []
    },
    {
      "slot_id": "INIT-P01-PRIVATE-02",
      "character_id": "P01-P04",
      "initial": true,
      "prince_ranks": [
        1
      ],
      "queen_rank": null,
      "queen_pool": [],
      "identity_pool": null,
      "group": "private",
      "basis": "reconstructed",
      "notes": "派遣先のcamp・IDのP07/P11を所属元に読み替えず、第1王子の出身枠で一度だけ数える。チヤマシ等の出航時の在室は別途確認。",
      "history": []
    },
    {
      "slot_id": "INIT-P01-PRIVATE-03",
      "character_id": "P01-P05",
      "initial": true,
      "prince_ranks": [
        1
      ],
      "queen_rank": null,
      "queen_pool": [],
      "identity_pool": null,
      "group": "private",
      "basis": "reconstructed",
      "notes": "派遣先のcamp・IDのP07/P11を所属元に読み替えず、第1王子の出身枠で一度だけ数える。チヤマシ等の出航時の在室は別途確認。",
      "history": []
    },
    {
      "slot_id": "INIT-P01-PRIVATE-04",
      "character_id": "P01-P06",
      "initial": true,
      "prince_ranks": [
        1
      ],
      "queen_rank": null,
      "queen_pool": [],
      "identity_pool": null,
      "group": "private",
      "basis": "reconstructed",
      "notes": "派遣先のcamp・IDのP07/P11を所属元に読み替えず、第1王子の出身枠で一度だけ数える。チヤマシ等の出航時の在室は別途確認。",
      "history": []
    },
    {
      "slot_id": "INIT-P01-PRIVATE-05",
      "character_id": "P01-P07",
      "initial": true,
      "prince_ranks": [
        1
      ],
      "queen_rank": null,
      "queen_pool": [],
      "identity_pool": null,
      "group": "private",
      "basis": "reconstructed",
      "notes": "派遣先のcamp・IDのP07/P11を所属元に読み替えず、第1王子の出身枠で一度だけ数える。チヤマシ等の出航時の在室は別途確認。",
      "history": []
    },
    {
      "slot_id": "INIT-P01-PRIVATE-06",
      "character_id": "P01-P08",
      "initial": true,
      "prince_ranks": [
        1
      ],
      "queen_rank": null,
      "queen_pool": [],
      "identity_pool": null,
      "group": "private",
      "basis": "reconstructed",
      "notes": "派遣先のcamp・IDのP07/P11を所属元に読み替えず、第1王子の出身枠で一度だけ数える。チヤマシ等の出航時の在室は別途確認。",
      "history": []
    },
    {
      "slot_id": "INIT-P01-PRIVATE-07",
      "character_id": "P01-P09",
      "initial": true,
      "prince_ranks": [
        1
      ],
      "queen_rank": null,
      "queen_pool": [],
      "identity_pool": null,
      "group": "private",
      "basis": "reconstructed",
      "notes": "派遣先のcamp・IDのP07/P11を所属元に読み替えず、第1王子の出身枠で一度だけ数える。チヤマシ等の出航時の在室は別途確認。",
      "history": []
    },
    {
      "slot_id": "INIT-P01-PRIVATE-08",
      "character_id": "P01-P10",
      "initial": true,
      "prince_ranks": [
        1
      ],
      "queen_rank": null,
      "queen_pool": [],
      "identity_pool": null,
      "group": "private",
      "basis": "reconstructed",
      "notes": "派遣先のcamp・IDのP07/P11を所属元に読み替えず、第1王子の出身枠で一度だけ数える。チヤマシ等の出航時の在室は別途確認。",
      "history": []
    },
    {
      "slot_id": "INIT-P01-PRIVATE-09",
      "character_id": "P01-P11",
      "initial": true,
      "prince_ranks": [
        1
      ],
      "queen_rank": null,
      "queen_pool": [],
      "identity_pool": null,
      "group": "private",
      "basis": "reconstructed",
      "notes": "派遣先のcamp・IDのP07/P11を所属元に読み替えず、第1王子の出身枠で一度だけ数える。チヤマシ等の出航時の在室は別途確認。",
      "history": []
    },
    {
      "slot_id": "INIT-P01-PRIVATE-10",
      "character_id": "P01-P12",
      "initial": true,
      "prince_ranks": [
        1
      ],
      "queen_rank": null,
      "queen_pool": [],
      "identity_pool": null,
      "group": "private",
      "basis": "reconstructed",
      "notes": "派遣先のcamp・IDのP07/P11を所属元に読み替えず、第1王子の出身枠で一度だけ数える。チヤマシ等の出航時の在室は別途確認。",
      "history": []
    },
    {
      "slot_id": "INIT-P01-PRIVATE-11",
      "character_id": "P01-P13",
      "initial": true,
      "prince_ranks": [
        1
      ],
      "queen_rank": null,
      "queen_pool": [],
      "identity_pool": null,
      "group": "private",
      "basis": "reconstructed",
      "notes": "派遣先のcamp・IDのP07/P11を所属元に読み替えず、第1王子の出身枠で一度だけ数える。チヤマシ等の出航時の在室は別途確認。",
      "history": []
    },
    {
      "slot_id": "INIT-P01-PRIVATE-12",
      "character_id": "P01-P16",
      "initial": true,
      "prince_ranks": [
        1
      ],
      "queen_rank": null,
      "queen_pool": [],
      "identity_pool": null,
      "group": "private",
      "basis": "reconstructed",
      "notes": "派遣先のcamp・IDのP07/P11を所属元に読み替えず、第1王子の出身枠で一度だけ数える。チヤマシ等の出航時の在室は別途確認。",
      "history": []
    },
    {
      "slot_id": "INIT-P01-PRIVATE-13",
      "character_id": "P07-G06",
      "initial": true,
      "prince_ranks": [
        1
      ],
      "queen_rank": null,
      "queen_pool": [],
      "identity_pool": null,
      "group": "private",
      "basis": "reconstructed",
      "notes": "派遣先のcamp・IDのP07/P11を所属元に読み替えず、第1王子の出身枠で一度だけ数える。チヤマシ等の出航時の在室は別途確認。",
      "history": []
    },
    {
      "slot_id": "INIT-P01-PRIVATE-14",
      "character_id": "P11-G01",
      "initial": true,
      "prince_ranks": [
        1
      ],
      "queen_rank": null,
      "queen_pool": [],
      "identity_pool": null,
      "group": "private",
      "basis": "reconstructed",
      "notes": "派遣先のcamp・IDのP07/P11を所属元に読み替えず、第1王子の出身枠で一度だけ数える。チヤマシ等の出航時の在室は別途確認。",
      "history": []
    },
    {
      "slot_id": "INIT-P01-PRIVATE-15",
      "character_id": "INIT-P01-PRIVATE-15",
      "initial": true,
      "prince_ranks": [
        1
      ],
      "queen_rank": null,
      "queen_pool": [],
      "identity_pool": null,
      "group": "private",
      "basis": "reconstructed",
      "notes": "派遣先のcamp・IDのP07/P11を所属元に読み替えず、第1王子の出身枠で一度だけ数える。チヤマシ等の出航時の在室は別途確認。",
      "history": []
    },
    {
      "slot_id": "INIT-P02-STAFF-01",
      "character_id": "P02-P01",
      "initial": true,
      "prince_ranks": [
        2
      ],
      "queen_rank": null,
      "queen_pool": [],
      "identity_pool": null,
      "group": "staff",
      "basis": "reconstructed",
      "notes": "第389話写真8〜9の呪詛担当13人・除念師1人・執事長1人。原図の私設兵12／従事者7との職種対応は未確定で、15人全員を私設兵12枠へは割り振らない。",
      "history": []
    },
    {
      "slot_id": "INIT-P02-STAFF-02",
      "character_id": "P02-P02",
      "initial": true,
      "prince_ranks": [
        2
      ],
      "queen_rank": null,
      "queen_pool": [],
      "identity_pool": null,
      "group": "staff",
      "basis": "reconstructed",
      "notes": "第389話写真8〜9の呪詛担当13人・除念師1人・執事長1人。原図の私設兵12／従事者7との職種対応は未確定で、15人全員を私設兵12枠へは割り振らない。",
      "history": []
    },
    {
      "slot_id": "INIT-P02-STAFF-03",
      "character_id": "P02-P03",
      "initial": true,
      "prince_ranks": [
        2
      ],
      "queen_rank": null,
      "queen_pool": [],
      "identity_pool": null,
      "group": "staff",
      "basis": "reconstructed",
      "notes": "第389話写真8〜9の呪詛担当13人・除念師1人・執事長1人。原図の私設兵12／従事者7との職種対応は未確定で、15人全員を私設兵12枠へは割り振らない。",
      "history": []
    },
    {
      "slot_id": "INIT-P02-STAFF-04",
      "character_id": "P02-P04",
      "initial": true,
      "prince_ranks": [
        2
      ],
      "queen_rank": null,
      "queen_pool": [],
      "identity_pool": null,
      "group": "staff",
      "basis": "reconstructed",
      "notes": "第389話写真8〜9の呪詛担当13人・除念師1人・執事長1人。原図の私設兵12／従事者7との職種対応は未確定で、15人全員を私設兵12枠へは割り振らない。",
      "history": []
    },
    {
      "slot_id": "INIT-P02-STAFF-05",
      "character_id": "P02-P05",
      "initial": true,
      "prince_ranks": [
        2
      ],
      "queen_rank": null,
      "queen_pool": [],
      "identity_pool": null,
      "group": "staff",
      "basis": "reconstructed",
      "notes": "第389話写真8〜9の呪詛担当13人・除念師1人・執事長1人。原図の私設兵12／従事者7との職種対応は未確定で、15人全員を私設兵12枠へは割り振らない。",
      "history": []
    },
    {
      "slot_id": "INIT-P02-STAFF-06",
      "character_id": "P02-P06",
      "initial": true,
      "prince_ranks": [
        2
      ],
      "queen_rank": null,
      "queen_pool": [],
      "identity_pool": null,
      "group": "staff",
      "basis": "reconstructed",
      "notes": "第389話写真8〜9の呪詛担当13人・除念師1人・執事長1人。原図の私設兵12／従事者7との職種対応は未確定で、15人全員を私設兵12枠へは割り振らない。",
      "history": []
    },
    {
      "slot_id": "INIT-P02-STAFF-07",
      "character_id": "P02-P07",
      "initial": true,
      "prince_ranks": [
        2
      ],
      "queen_rank": null,
      "queen_pool": [],
      "identity_pool": null,
      "group": "staff",
      "basis": "reconstructed",
      "notes": "第389話写真8〜9の呪詛担当13人・除念師1人・執事長1人。原図の私設兵12／従事者7との職種対応は未確定で、15人全員を私設兵12枠へは割り振らない。",
      "history": []
    },
    {
      "slot_id": "INIT-P02-STAFF-08",
      "character_id": "P02-P08",
      "initial": true,
      "prince_ranks": [
        2
      ],
      "queen_rank": null,
      "queen_pool": [],
      "identity_pool": null,
      "group": "staff",
      "basis": "reconstructed",
      "notes": "第389話写真8〜9の呪詛担当13人・除念師1人・執事長1人。原図の私設兵12／従事者7との職種対応は未確定で、15人全員を私設兵12枠へは割り振らない。",
      "history": []
    },
    {
      "slot_id": "INIT-P02-STAFF-09",
      "character_id": "P02-P09",
      "initial": true,
      "prince_ranks": [
        2
      ],
      "queen_rank": null,
      "queen_pool": [],
      "identity_pool": null,
      "group": "staff",
      "basis": "reconstructed",
      "notes": "第389話写真8〜9の呪詛担当13人・除念師1人・執事長1人。原図の私設兵12／従事者7との職種対応は未確定で、15人全員を私設兵12枠へは割り振らない。",
      "history": []
    },
    {
      "slot_id": "INIT-P02-STAFF-10",
      "character_id": "P02-P10",
      "initial": true,
      "prince_ranks": [
        2
      ],
      "queen_rank": null,
      "queen_pool": [],
      "identity_pool": null,
      "group": "staff",
      "basis": "reconstructed",